{
  "$schema": "https://json-schema.org/draft/2020-12/schema",
  "$id": "https://generic-dev-studio.local/core/v2/schemas/checkpoint-next-steps.schema.json",
  "title": "Studio v2 checkpoint next steps",
  "type": "object",
  "additionalProperties": false,
  "required": ["schema_version", "kind", "checkpoint_id", "items"],
  "properties": {
    "schema_version": { "type": "integer", "const": 1 },
    "kind": { "const": "studio-v2-checkpoint-next-steps" },
    "checkpoint_id": { "type": "string", "minLength": 1 },
    "items": {
      "type": "array",
      "items": {
        "type": "object",
        "additionalProperties": false,
        "required": ["id", "status", "summary", "owner_role"],
        "properties": {
          "id": { "type": "string", "minLength": 1 },
          "status": { "enum": ["pending", "in-progress", "blocked", "done"] },
          "summary": { "type": "string", "minLength": 1, "maxLength": 500 },
          "owner_role": { "type": "string", "pattern": "^[a-z][a-z0-9-]*$" },
          "blocking_reason": { "type": ["string", "null"], "maxLength": 500 },
          "evidence_refs": {
            "type": "array",
            "items": { "type": "string", "minLength": 1 },
            "uniqueItems": true
          }
        }
      }
    }
  }
}
